Declare,metatab-latest
Name,drink_water
Description,Unsafe Drinking Water: Percent of the population served by Community Water Systems not meeting Safe Drinking Water Act  regulations
Identifier,4d2174b0-be28-4140-b052-2ce0a4068a9e
Version,1

Section,Resources,Name,Schema,Space,Time,Description
Datafile,https://www.cdph.ca.gov/programs/Documents/HCI_DrinkingWater_CA_RE_CO_CD_PL_CT-A-N-6-19-14.zip#HCI_DrinkingWater_CA_RE_CO_CD_PL_CT-A-N-6-19-14.xlsx;drinking_water,data-drink_water-ballance,drink_water,ballance,,Unsafe Drinking Water: Percent of the population served by Community Water Systems not meeting Safe Drinking Water Act  regulations
Datafile,https://www.cdph.ca.gov/programs/Documents/HCI_DrinkingWater_CA_RE_CO_CD_PL_CT-O-Y-6-19-14.zip#HCI_DrinkingWater_CA_RE_CO_CD_PL_CT-O-Y-6-19-14.xlsx;drinking_water,data-drink_water-orange_yuba,drink_water,orange_yuba,,Unsafe Drinking Water: Percent of the population served by Community Water Systems not meeting Safe Drinking Water Act  regulations
Suplimentarydata,https://www.cdph.ca.gov/programs/Documents/HCI_DrinkingWater_CA_RE_CO_CD_PL_CT-A-N-6-19-14.zip#HCI_DrinkingWater_CA_RE_CO_CD_PL_CT-A-N-6-19-14.xlsx;MPO_County_CMSA_list,supdata-drink_water-ballance,drink_water,ballance,,Unsafe Drinking Water: Percent of the population served by Community Water Systems not meeting Safe Drinking Water Act  regulations
Suplimentarydata,https://www.cdph.ca.gov/programs/Documents/HCI_DrinkingWater_CA_RE_CO_CD_PL_CT-O-Y-6-19-14.zip#HCI_DrinkingWater_CA_RE_CO_CD_PL_CT-O-Y-6-19-14.xlsx;MPO_County_CMSA_list,supdata-drink_water-orange_yuba,drink_water,orange_yuba,,Unsafe Drinking Water: Percent of the population served by Community Water Systems not meeting Safe Drinking Water Act  regulations

Section,Documentation,Name,Schema,Space,Time,Title,Description
Datadictionary,https://www.cdph.ca.gov/programs/Documents/HCI_DrinkingWater_CA_RE_CO_CD_PL_CT-A-N-6-19-14.zip#HCI_DrinkingWater_CA_RE_CO_CD_PL_CT-A-N-6-19-14.xlsx;DataDictionary,dd-drink_water-ballance,drink_water,ballance,,,Unsafe Drinking Water: Percent of the population served by Community Water Systems not meeting Safe Drinking Water Act  regulations
Datadictionary,https://www.cdph.ca.gov/programs/Documents/HCI_DrinkingWater_CA_RE_CO_CD_PL_CT-O-Y-6-19-14.zip#HCI_DrinkingWater_CA_RE_CO_CD_PL_CT-O-Y-6-19-14.xlsx;DataDictionary,dd-drink_water-orange_yuba,drink_water,orange_yuba,,,Unsafe Drinking Water: Percent of the population served by Community Water Systems not meeting Safe Drinking Water Act  regulations
Documentation,https://www.cdph.ca.gov/programs/Documents/HCI_DrinkingWater_CA_RE_CO_CD_PL_CT-A-N-6-19-14.zip#HCI_DrinkingWater_CA_RE_CO_CD_PL_CT-A-N-6-19-14.xlsx;DataFilteringInstructions,doc-drink_water-ballance,drink_water,ballance,,,Unsafe Drinking Water: Percent of the population served by Community Water Systems not meeting Safe Drinking Water Act  regulations
Documentation,https://www.cdph.ca.gov/programs/Documents/HCI_DrinkingWater_CA_RE_CO_CD_PL_CT-O-Y-6-19-14.zip#HCI_DrinkingWater_CA_RE_CO_CD_PL_CT-O-Y-6-19-14.xlsx;DataFilteringInstructions,doc-drink_water-orange_yuba,drink_water,orange_yuba,,,Unsafe Drinking Water: Percent of the population served by Community Water Systems not meeting Safe Drinking Water Act  regulations

Section,Schema,DataType,AltName,Description,Widthformat,Coding
Table,drink_water,,,,,
Column,ind_id,number,,Indicator ID,3.0,556.0
Column,ind_definition,text,,Definition of indicator in plain language,255.0,Free text
Column,reportyear,text,,Year that the indicator was reported,9.0,2008-2012
Column,race_eth_code,number,,numeric code for a race/ethnicity group,1.0,1=American Indian or Alaska Native; 2=Asian; 3=Black or African American; 4=Hispanic or Latino; 5=Native Hawaiian or Other Pacific Islander (NHOPI); 6=White;7= Multiple; 8=Other;9=Total
Column,race_eth_name,text,,Name of race/ethnic group,9.0,AIAN; Asian; AfricanAm; Latino; NHOPI; White; Multiple; Other; Total
Column,geotype,text,,Type of geographic unit,2.0,CT; Census Tract; PL;Place; CD; County Division; CO;County; RE; Region CA;State
Column,geotypevalue,number,,Value of geographic unit,single prec.,"FIPS ID; place code, CT code, zip code, region id, CD id"
Column,geoname,text,,Name of geographic unit,37.0,"Census tract, place, county division, county, region name"
Column,county_name,text,,Name of county that geotype is in,25.0,
Column,county_fips,text,,FIPS code of county that geotype is in,5.0,2-digit census state code (06) plus 3-digit census county code
Column,region_name,text,,MPO-based region name; see MPO_County list tab,26.0,
Column,region_code,text,,MPO-based region code; see MPO_County list tab,2.0,01=Bay Area; 02=Butte; 03=Central/Southeast Sierra; 04=Monterey Bay; 05=North Coast; 06=Northeast Sierra; 07=Northern Sacramento Valley; 08=Sacramento Area; 09=San Diego; 10=San Joaquin Valley; 11=San Luis Obispo; 12=Santa Barbara; 13=Shasta; 14=Southern California
Column,category,text,,type of violation,8.0,"arsenic = MCL arsenic violations, nitrates = MCL nitrates violations, other=other MCL violations, tcrb=total coliform rule-bacteriologic MCL violations, total=all types of violations"
Column,numerator,number,,Number of people served by a community water system with at least one MLC/TT violation in the period 2008-2012,double prec.,
Column,denominator,number,,Number of people served by community water systems,double prec.,
Column,percent,number,,Numerator/denominator*100,double prec.,
Column,ll_95ci,number,,Lower limit of 95% confidence interval,double prec.,
Column,ul_95ci,number,,Lower limit of 95% confidence interval,double prec.,
Column,se,number,,Standard error,double prec.,
Column,rse,number,,Relative standard error,double prec.,
Column,ca_decile,integer,,California decile,integer,"CA_decile' groups California places into 10 groups (or deciles) each, for total population. Equal values or 'ties' are assigned the mean decile rank. For example, in a database of 100 records where 70 records equal 0, 0 values span from the 1st to 7th deciles (70% of all data records)."
Column,ca_rr,number,,Rate ratio to California rate,double prec.,
Column,tot_pop,,,Total population,,
Column,coverage,number,,"Percent of the total population served by the community water systems included in the California Environmental Health Tracking Program, Water System Boundary Tool",double prec.,
Column,version,datetime,,Date/time stamp of version of data,,mm/DD/CCYY hh:mm:ss
